{
  "schema_version": 1,
  "family": {
    "id": "object-oriented",
    "name": "Object-oriented design",
    "scope": "Class and object collaboration patterns from the Gang of Four catalog."
  },
  "defaults": {
    "aliases": [],
    "family": "object-oriented",
    "level": "code",
    "maturity": "indexed",
    "sources": [
      {
        "title": "Design Patterns: Elements of Reusable Object-Oriented Software",
        "url": "https://www.informit.com/store/design-patterns-elements-of-reusable-object-oriented-software-9780201633610",
        "type": "primary"
      }
    ]
  },
  "patterns": [
    {
      "id": "object-oriented-abstract-factory",
      "name": "Abstract Factory"
    },
    {
      "id": "object-oriented-builder",
      "name": "Builder"
    },
    {
      "id": "object-oriented-factory-method",
      "name": "Factory Method"
    },
    {
      "id": "object-oriented-prototype",
      "name": "Prototype"
    },
    {
      "id": "object-oriented-singleton",
      "name": "Singleton"
    },
    {
      "id": "object-oriented-adapter",
      "name": "Adapter"
    },
    {
      "id": "object-oriented-bridge",
      "name": "Bridge"
    },
    {
      "id": "object-oriented-composite",
      "name": "Composite"
    },
    {
      "id": "object-oriented-decorator",
      "name": "Decorator"
    },
    {
      "id": "object-oriented-facade",
      "name": "Facade"
    },
    {
      "id": "object-oriented-flyweight",
      "name": "Flyweight"
    },
    {
      "id": "object-oriented-proxy",
      "name": "Proxy"
    },
    {
      "id": "object-oriented-chain-of-responsibility",
      "name": "Chain of Responsibility"
    },
    {
      "id": "object-oriented-command",
      "name": "Command"
    },
    {
      "id": "object-oriented-interpreter",
      "name": "Interpreter"
    },
    {
      "id": "object-oriented-iterator",
      "name": "Iterator"
    },
    {
      "id": "object-oriented-mediator",
      "name": "Mediator"
    },
    {
      "id": "object-oriented-memento",
      "name": "Memento"
    },
    {
      "id": "object-oriented-observer",
      "name": "Observer"
    },
    {
      "id": "object-oriented-state",
      "name": "State"
    },
    {
      "id": "object-oriented-strategy",
      "name": "Strategy"
    },
    {
      "id": "object-oriented-template-method",
      "name": "Template Method"
    },
    {
      "id": "object-oriented-visitor",
      "name": "Visitor"
    }
  ]
}
