{
  "schema_version": 1,
  "family": {
    "id": "microservices",
    "name": "Microservices",
    "scope": "The current microservices.io pattern-language index, including alternatives and refactoring patterns."
  },
  "defaults": {
    "aliases": [],
    "family": "microservices",
    "level": "architecture",
    "maturity": "indexed",
    "sources": [
      {
        "title": "A pattern language for microservices",
        "url": "https://microservices.io/patterns/",
        "type": "primary"
      }
    ]
  },
  "patterns": [
    {
      "id": "microservices-monolithic-architecture",
      "name": "Monolithic architecture",
      "source_path": "monolithic.html"
    },
    {
      "id": "microservices-microservice-architecture",
      "name": "Microservice architecture",
      "source_path": "microservices.html"
    },
    {
      "id": "microservices-decompose-by-business-capability",
      "name": "Decompose by business capability",
      "source_path": "decomposition/decompose-by-business-capability.html"
    },
    {
      "id": "microservices-decompose-by-subdomain",
      "name": "Decompose by subdomain",
      "source_path": "decomposition/decompose-by-subdomain.html"
    },
    {
      "id": "microservices-self-contained-service",
      "name": "Self-contained Service",
      "source_path": "decomposition/self-contained-service.html"
    },
    {
      "id": "microservices-service-per-team",
      "name": "Service per team",
      "source_path": "/patterns/decomposition/service-per-team.html"
    },
    {
      "id": "microservices-strangler-application",
      "name": "Strangler Application",
      "source_path": "/patterns/refactoring/strangler-application.html"
    },
    {
      "id": "microservices-anti-corruption-layer",
      "name": "Anti-corruption layer",
      "source_path": "/patterns/refactoring/anti-corruption-layer.html"
    },
    {
      "id": "microservices-database-per-service",
      "name": "Database per Service",
      "source_path": "data/database-per-service.html"
    },
    {
      "id": "microservices-shared-database",
      "name": "Shared database",
      "source_path": "data/shared-database.html"
    },
    {
      "id": "microservices-saga",
      "name": "Saga",
      "source_path": "data/saga.html"
    },
    {
      "id": "microservices-command-side-replica",
      "name": "Command-side replica",
      "source_path": "data/command-side-replica.html"
    },
    {
      "id": "microservices-api-composition",
      "name": "API Composition",
      "source_path": "data/api-composition.html"
    },
    {
      "id": "microservices-cqrs",
      "name": "CQRS",
      "source_path": "data/cqrs.html"
    },
    {
      "id": "microservices-domain-event",
      "name": "Domain event",
      "source_path": "/patterns/data/domain-event.html"
    },
    {
      "id": "microservices-event-sourcing",
      "name": "Event sourcing",
      "source_path": "data/event-sourcing.html"
    },
    {
      "id": "microservices-transactional-outbox",
      "name": "Transactional outbox",
      "source_path": "data/transactional-outbox.html"
    },
    {
      "id": "microservices-transaction-log-tailing",
      "name": "Transaction log tailing",
      "source_path": "data/transaction-log-tailing.html"
    },
    {
      "id": "microservices-polling-publisher",
      "name": "Polling publisher",
      "source_path": "data/polling-publisher.html"
    },
    {
      "id": "microservices-consumer-driven-contract-test",
      "name": "Consumer-driven contract test",
      "source_path": "testing/service-integration-contract-test.html"
    },
    {
      "id": "microservices-consumer-side-contract-test",
      "name": "Consumer-side contract test",
      "source_path": "testing/service-integration-contract-test.html"
    },
    {
      "id": "microservices-service-component-test",
      "name": "Service component test",
      "source_path": "testing/service-component-test.html"
    },
    {
      "id": "microservices-multiple-service-instances-per-host",
      "name": "Multiple service instances per host",
      "source_path": "deployment/multiple-services-per-host.html"
    },
    {
      "id": "microservices-service-instance-per-host",
      "name": "Service instance per host",
      "source_path": "deployment/single-service-per-host.html"
    },
    {
      "id": "microservices-service-instance-per-vm",
      "name": "Service instance per VM",
      "source_path": "deployment/service-per-vm.html"
    },
    {
      "id": "microservices-service-instance-per-container",
      "name": "Service instance per Container",
      "source_path": "deployment/service-per-container.html"
    },
    {
      "id": "microservices-serverless-deployment",
      "name": "Serverless deployment",
      "source_path": "/patterns/deployment/serverless-deployment.html"
    },
    {
      "id": "microservices-service-deployment-platform",
      "name": "Service deployment platform",
      "source_path": "/patterns/deployment/service-deployment-platform.html"
    },
    {
      "id": "microservices-microservice-chassis",
      "name": "Microservice chassis",
      "source_path": "/patterns/microservice-chassis.html"
    },
    {
      "id": "microservices-externalized-configuration",
      "name": "Externalized configuration",
      "source_path": "/patterns/externalized-configuration.html"
    },
    {
      "id": "microservices-service-template",
      "name": "Service Template",
      "source_path": "/patterns/service-template.html"
    },
    {
      "id": "microservices-remote-procedure-invocation",
      "name": "Remote Procedure Invocation",
      "source_path": "communication-style/rpi.html"
    },
    {
      "id": "microservices-messaging",
      "name": "Messaging",
      "source_path": "communication-style/messaging.html"
    },
    {
      "id": "microservices-domain-specific-protocol",
      "name": "Domain-specific protocol",
      "source_path": "communication-style/domain-specific.html"
    },
    {
      "id": "microservices-idempotent-consumer",
      "name": "Idempotent Consumer",
      "source_path": "/patterns/communication-style/idempotent-consumer.html"
    },
    {
      "id": "microservices-api-gateway",
      "name": "API gateway",
      "source_path": "apigateway.html"
    },
    {
      "id": "microservices-backend-for-front-end",
      "name": "Backend for front-end",
      "source_path": "apigateway.html"
    },
    {
      "id": "microservices-client-side-discovery",
      "name": "Client-side discovery",
      "source_path": "client-side-discovery.html"
    },
    {
      "id": "microservices-server-side-discovery",
      "name": "Server-side discovery",
      "source_path": "server-side-discovery.html"
    },
    {
      "id": "microservices-service-registry",
      "name": "Service registry",
      "source_path": "service-registry.html"
    },
    {
      "id": "microservices-self-registration",
      "name": "Self registration",
      "source_path": "self-registration.html"
    },
    {
      "id": "microservices-3rd-party-registration",
      "name": "3rd party registration",
      "source_path": "3rd-party-registration.html"
    },
    {
      "id": "microservices-circuit-breaker",
      "name": "Circuit Breaker",
      "source_path": "reliability/circuit-breaker.html"
    },
    {
      "id": "microservices-access-token",
      "name": "Access Token",
      "source_path": "security/access-token.html"
    },
    {
      "id": "microservices-log-aggregation",
      "name": "Log aggregation",
      "source_path": "observability/application-logging.html"
    },
    {
      "id": "microservices-application-metrics",
      "name": "Application metrics",
      "source_path": "observability/application-metrics.html"
    },
    {
      "id": "microservices-audit-logging",
      "name": "Audit logging",
      "source_path": "observability/audit-logging.html"
    },
    {
      "id": "microservices-distributed-tracing",
      "name": "Distributed tracing",
      "source_path": "observability/distributed-tracing.html"
    },
    {
      "id": "microservices-exception-tracking",
      "name": "Exception tracking",
      "source_path": "observability/exception-tracking.html"
    },
    {
      "id": "microservices-health-check-api",
      "name": "Health check API",
      "source_path": "observability/health-check-api.html"
    },
    {
      "id": "microservices-log-deployments-and-changes",
      "name": "Log deployments and changes",
      "source_path": "/patterns/observability/log-deployments-and-changes.html"
    },
    {
      "id": "microservices-server-side-page-fragment-composition",
      "name": "Server-side page fragment composition",
      "source_path": "ui/server-side-page-fragment-composition.html"
    },
    {
      "id": "microservices-client-side-ui-composition",
      "name": "Client-side UI composition",
      "source_path": "ui/client-side-ui-composition.html"
    }
  ]
}
