{
  "schema_version": 1,
  "family": {
    "id": "enterprise-application",
    "name": "Enterprise application architecture",
    "scope": "Patterns of Enterprise Application Architecture catalog."
  },
  "defaults": {
    "aliases": [],
    "family": "enterprise-application",
    "level": "application",
    "maturity": "indexed",
    "sources": [
      {
        "title": "Patterns of Enterprise Application Architecture Catalog",
        "url": "https://martinfowler.com/eaaCatalog/",
        "type": "primary"
      }
    ]
  },
  "patterns": [
    {
      "id": "enterprise-application-transaction-script",
      "name": "Transaction Script",
      "source_path": "transactionScript.html"
    },
    {
      "id": "enterprise-application-domain-model",
      "name": "Domain Model",
      "source_path": "domainModel.html"
    },
    {
      "id": "enterprise-application-table-module",
      "name": "Table Module",
      "source_path": "tableModule.html"
    },
    {
      "id": "enterprise-application-service-layer",
      "name": "Service Layer",
      "source_path": "serviceLayer.html"
    },
    {
      "id": "enterprise-application-table-data-gateway",
      "name": "Table Data Gateway",
      "source_path": "tableDataGateway.html"
    },
    {
      "id": "enterprise-application-row-data-gateway",
      "name": "Row Data Gateway",
      "source_path": "rowDataGateway.html"
    },
    {
      "id": "enterprise-application-active-record",
      "name": "Active Record",
      "source_path": "activeRecord.html"
    },
    {
      "id": "enterprise-application-data-mapper",
      "name": "Data Mapper",
      "source_path": "dataMapper.html"
    },
    {
      "id": "enterprise-application-unit-of-work",
      "name": "Unit of Work",
      "source_path": "unitOfWork.html"
    },
    {
      "id": "enterprise-application-identity-map",
      "name": "Identity Map",
      "source_path": "identityMap.html"
    },
    {
      "id": "enterprise-application-lazy-load",
      "name": "Lazy Load",
      "source_path": "lazyLoad.html"
    },
    {
      "id": "enterprise-application-identity-field",
      "name": "Identity Field",
      "source_path": "identityField.html"
    },
    {
      "id": "enterprise-application-inheritance-mappers",
      "name": "Inheritance Mappers",
      "source_path": "inheritanceMappers.html"
    },
    {
      "id": "enterprise-application-foreign-key-mapping",
      "name": "Foreign Key Mapping",
      "source_path": "foreignKeyMapping.html"
    },
    {
      "id": "enterprise-application-association-table-mapping",
      "name": "Association Table Mapping",
      "source_path": "associationTableMapping.html"
    },
    {
      "id": "enterprise-application-dependent-mapping",
      "name": "Dependent Mapping",
      "source_path": "dependentMapping.html"
    },
    {
      "id": "enterprise-application-embedded-value",
      "name": "Embedded Value",
      "source_path": "embeddedValue.html"
    },
    {
      "id": "enterprise-application-serialized-lob",
      "name": "Serialized LOB",
      "source_path": "serializedLOB.html"
    },
    {
      "id": "enterprise-application-single-table-inheritance",
      "name": "Single Table Inheritance",
      "source_path": "singleTableInheritance.html"
    },
    {
      "id": "enterprise-application-class-table-inheritance",
      "name": "Class Table Inheritance",
      "source_path": "classTableInheritance.html"
    },
    {
      "id": "enterprise-application-concrete-table-inheritance",
      "name": "Concrete Table Inheritance",
      "source_path": "concreteTableInheritance.html"
    },
    {
      "id": "enterprise-application-metadata-mapping",
      "name": "Metadata Mapping",
      "source_path": "metadataMapping.html"
    },
    {
      "id": "enterprise-application-query-object",
      "name": "Query Object",
      "source_path": "queryObject.html"
    },
    {
      "id": "enterprise-application-repository",
      "name": "Repository",
      "source_path": "repository.html"
    },
    {
      "id": "enterprise-application-model-view-controller",
      "name": "Model View Controller",
      "source_path": "modelViewController.html"
    },
    {
      "id": "enterprise-application-page-controller",
      "name": "Page Controller",
      "source_path": "pageController.html"
    },
    {
      "id": "enterprise-application-front-controller",
      "name": "Front Controller",
      "source_path": "frontController.html"
    },
    {
      "id": "enterprise-application-template-view",
      "name": "Template View",
      "source_path": "templateView.html"
    },
    {
      "id": "enterprise-application-transform-view",
      "name": "Transform View",
      "source_path": "transformView.html"
    },
    {
      "id": "enterprise-application-two-step-view",
      "name": "Two Step View",
      "source_path": "twoStepView.html"
    },
    {
      "id": "enterprise-application-application-controller",
      "name": "Application Controller",
      "source_path": "applicationController.html"
    },
    {
      "id": "enterprise-application-remote-facade",
      "name": "Remote Facade",
      "source_path": "remoteFacade.html"
    },
    {
      "id": "enterprise-application-data-transfer-object",
      "name": "Data Transfer Object",
      "source_path": "dataTransferObject.html"
    },
    {
      "id": "enterprise-application-optimistic-offline-lock",
      "name": "Optimistic Offline Lock",
      "source_path": "optimisticOfflineLock.html"
    },
    {
      "id": "enterprise-application-pessimistic-offline-lock",
      "name": "Pessimistic Offline Lock",
      "source_path": "pessimisticOfflineLock.html"
    },
    {
      "id": "enterprise-application-coarse-grained-lock",
      "name": "Coarse-Grained Lock",
      "source_path": "coarseGrainedLock.html"
    },
    {
      "id": "enterprise-application-implicit-lock",
      "name": "Implicit Lock",
      "source_path": "implicitLock.html"
    },
    {
      "id": "enterprise-application-client-session-state",
      "name": "Client Session State",
      "source_path": "clientSessionState.html"
    },
    {
      "id": "enterprise-application-server-session-state",
      "name": "Server Session State",
      "source_path": "serverSessionState.html"
    },
    {
      "id": "enterprise-application-database-session-state",
      "name": "Database Session State",
      "source_path": "databaseSessionState.html"
    },
    {
      "id": "enterprise-application-gateway",
      "name": "Gateway",
      "source_path": "gateway.html"
    },
    {
      "id": "enterprise-application-service-stub",
      "name": "Service Stub",
      "source_path": "serviceStub.html"
    },
    {
      "id": "enterprise-application-record-set",
      "name": "Record Set",
      "source_path": "recordSet.html"
    },
    {
      "id": "enterprise-application-mapper",
      "name": "Mapper",
      "source_path": "mapper.html"
    },
    {
      "id": "enterprise-application-layer-supertype",
      "name": "Layer Supertype",
      "source_path": "layerSupertype.html"
    },
    {
      "id": "enterprise-application-separated-interface",
      "name": "Separated Interface",
      "source_path": "separatedInterface.html"
    },
    {
      "id": "enterprise-application-registry",
      "name": "Registry",
      "source_path": "registry.html"
    },
    {
      "id": "enterprise-application-value-object",
      "name": "Value Object",
      "source_path": "valueObject.html"
    },
    {
      "id": "enterprise-application-money",
      "name": "Money",
      "source_path": "money.html"
    },
    {
      "id": "enterprise-application-special-case",
      "name": "Special Case",
      "source_path": "specialCase.html"
    },
    {
      "id": "enterprise-application-plugin",
      "name": "Plugin",
      "source_path": "plugin.html"
    }
  ]
}
