{
  "schema_version": 1,
  "family": {
    "id": "domain-driven-design",
    "name": "Domain-driven design",
    "scope": "Tactical and strategic patterns in Eric Evans’s DDD reference."
  },
  "defaults": {
    "aliases": [],
    "family": "domain-driven-design",
    "level": "domain",
    "maturity": "indexed",
    "sources": [
      {
        "title": "Domain-Driven Design Reference",
        "url": "https://www.domainlanguage.com/wp-content/uploads/2016/05/DDD_Reference_2015-03.pdf",
        "type": "primary"
      }
    ]
  },
  "patterns": [
    {
      "id": "domain-driven-design-bounded-context",
      "name": "Bounded Context"
    },
    {
      "id": "domain-driven-design-ubiquitous-language",
      "name": "Ubiquitous Language"
    },
    {
      "id": "domain-driven-design-continuous-integration",
      "name": "Continuous Integration"
    },
    {
      "id": "domain-driven-design-model-driven-design",
      "name": "Model-Driven Design"
    },
    {
      "id": "domain-driven-design-hands-on-modelers",
      "name": "Hands-on Modelers"
    },
    {
      "id": "domain-driven-design-refactoring-toward-deeper-insight",
      "name": "Refactoring Toward Deeper Insight"
    },
    {
      "id": "domain-driven-design-layered-architecture",
      "name": "Layered Architecture"
    },
    {
      "id": "domain-driven-design-entities",
      "name": "Entities"
    },
    {
      "id": "domain-driven-design-value-objects",
      "name": "Value Objects"
    },
    {
      "id": "domain-driven-design-domain-events",
      "name": "Domain Events"
    },
    {
      "id": "domain-driven-design-services",
      "name": "Services"
    },
    {
      "id": "domain-driven-design-modules",
      "name": "Modules"
    },
    {
      "id": "domain-driven-design-aggregates",
      "name": "Aggregates"
    },
    {
      "id": "domain-driven-design-repositories",
      "name": "Repositories"
    },
    {
      "id": "domain-driven-design-factories",
      "name": "Factories"
    },
    {
      "id": "domain-driven-design-intention-revealing-interfaces",
      "name": "Intention-Revealing Interfaces"
    },
    {
      "id": "domain-driven-design-side-effect-free-functions",
      "name": "Side-Effect-Free Functions"
    },
    {
      "id": "domain-driven-design-assertions",
      "name": "Assertions"
    },
    {
      "id": "domain-driven-design-standalone-classes",
      "name": "Standalone Classes"
    },
    {
      "id": "domain-driven-design-closure-of-operations",
      "name": "Closure of Operations"
    },
    {
      "id": "domain-driven-design-declarative-design",
      "name": "Declarative Design"
    },
    {
      "id": "domain-driven-design-drawing-on-established-formalisms",
      "name": "Drawing on Established Formalisms"
    },
    {
      "id": "domain-driven-design-conceptual-contours",
      "name": "Conceptual Contours"
    },
    {
      "id": "domain-driven-design-context-map",
      "name": "Context Map"
    },
    {
      "id": "domain-driven-design-partnership",
      "name": "Partnership"
    },
    {
      "id": "domain-driven-design-shared-kernel",
      "name": "Shared Kernel"
    },
    {
      "id": "domain-driven-design-customer-supplier-development",
      "name": "Customer/Supplier Development"
    },
    {
      "id": "domain-driven-design-conformist",
      "name": "Conformist"
    },
    {
      "id": "domain-driven-design-anticorruption-layer",
      "name": "Anticorruption Layer"
    },
    {
      "id": "domain-driven-design-open-host-service",
      "name": "Open-host Service"
    },
    {
      "id": "domain-driven-design-published-language",
      "name": "Published Language"
    },
    {
      "id": "domain-driven-design-separate-ways",
      "name": "Separate Ways"
    },
    {
      "id": "domain-driven-design-big-ball-of-mud",
      "name": "Big Ball of Mud"
    },
    {
      "id": "domain-driven-design-core-domain",
      "name": "Core Domain"
    },
    {
      "id": "domain-driven-design-generic-subdomains",
      "name": "Generic Subdomains"
    },
    {
      "id": "domain-driven-design-domain-vision-statement",
      "name": "Domain Vision Statement"
    },
    {
      "id": "domain-driven-design-highlighted-core",
      "name": "Highlighted Core"
    },
    {
      "id": "domain-driven-design-cohesive-mechanisms",
      "name": "Cohesive Mechanisms"
    },
    {
      "id": "domain-driven-design-segregated-core",
      "name": "Segregated Core"
    },
    {
      "id": "domain-driven-design-abstract-core",
      "name": "Abstract Core"
    },
    {
      "id": "domain-driven-design-evolving-order",
      "name": "Evolving Order"
    },
    {
      "id": "domain-driven-design-system-metaphor",
      "name": "System Metaphor"
    },
    {
      "id": "domain-driven-design-responsibility-layers",
      "name": "Responsibility Layers"
    },
    {
      "id": "domain-driven-design-knowledge-level",
      "name": "Knowledge Level"
    },
    {
      "id": "domain-driven-design-pluggable-component-framework",
      "name": "Pluggable Component Framework"
    }
  ]
}
