{
  "schema_version": 1,
  "family": {
    "id": "testing",
    "name": "Automated testing",
    "scope": "The xUnit Test Patterns catalog."
  },
  "defaults": {
    "aliases": [],
    "family": "testing",
    "level": "test",
    "maturity": "indexed",
    "sources": [
      {
        "title": "xUnit Test Patterns",
        "url": "http://xunitpatterns.com/List%20of%20Patterns.html",
        "type": "primary",
        "transport": "legacy-http"
      }
    ]
  },
  "patterns": [
    {
      "id": "testing-assertion-message",
      "name": "Assertion Message"
    },
    {
      "id": "testing-assertion-method",
      "name": "Assertion Method"
    },
    {
      "id": "testing-automated-teardown",
      "name": "Automated Teardown"
    },
    {
      "id": "testing-back-door-manipulation",
      "name": "Back Door Manipulation"
    },
    {
      "id": "testing-behavior-verification",
      "name": "Behavior Verification"
    },
    {
      "id": "testing-chained-tests",
      "name": "Chained Tests"
    },
    {
      "id": "testing-configurable-test-double",
      "name": "Configurable Test Double"
    },
    {
      "id": "testing-creation-method",
      "name": "Creation Method"
    },
    {
      "id": "testing-custom-assertion",
      "name": "Custom Assertion"
    },
    {
      "id": "testing-data-driven-test",
      "name": "Data-Driven Test"
    },
    {
      "id": "testing-database-sandbox",
      "name": "Database Sandbox"
    },
    {
      "id": "testing-delegated-setup",
      "name": "Delegated Setup"
    },
    {
      "id": "testing-delta-assertion",
      "name": "Delta Assertion"
    },
    {
      "id": "testing-dependency-injection",
      "name": "Dependency Injection"
    },
    {
      "id": "testing-dependency-lookup",
      "name": "Dependency Lookup"
    },
    {
      "id": "testing-derived-value",
      "name": "Derived Value"
    },
    {
      "id": "testing-dummy-object",
      "name": "Dummy Object"
    },
    {
      "id": "testing-fake-object",
      "name": "Fake Object"
    },
    {
      "id": "testing-four-phase-test",
      "name": "Four-Phase Test"
    },
    {
      "id": "testing-fresh-fixture",
      "name": "Fresh Fixture"
    },
    {
      "id": "testing-garbage-collected-teardown",
      "name": "Garbage-Collected Teardown"
    },
    {
      "id": "testing-generated-value",
      "name": "Generated Value"
    },
    {
      "id": "testing-guard-assertion",
      "name": "Guard Assertion"
    },
    {
      "id": "testing-hard-coded-test-double",
      "name": "Hard-Coded Test Double"
    },
    {
      "id": "testing-humble-object",
      "name": "Humble Object"
    },
    {
      "id": "testing-implicit-setup",
      "name": "Implicit Setup"
    },
    {
      "id": "testing-implicit-teardown",
      "name": "Implicit Teardown"
    },
    {
      "id": "testing-inline-setup",
      "name": "Inline Setup"
    },
    {
      "id": "testing-inline-teardown",
      "name": "Inline Teardown"
    },
    {
      "id": "testing-layer-test",
      "name": "Layer Test"
    },
    {
      "id": "testing-lazy-setup",
      "name": "Lazy Setup"
    },
    {
      "id": "testing-literal-value",
      "name": "Literal Value"
    },
    {
      "id": "testing-minimal-fixture",
      "name": "Minimal Fixture"
    },
    {
      "id": "testing-mock-object",
      "name": "Mock Object"
    },
    {
      "id": "testing-named-test-suite",
      "name": "Named Test Suite"
    },
    {
      "id": "testing-parameterized-test",
      "name": "Parameterized Test"
    },
    {
      "id": "testing-prebuilt-fixture",
      "name": "Prebuilt Fixture"
    },
    {
      "id": "testing-recorded-test",
      "name": "Recorded Test"
    },
    {
      "id": "testing-scripted-test",
      "name": "Scripted Test"
    },
    {
      "id": "testing-setup-decorator",
      "name": "Setup Decorator"
    },
    {
      "id": "testing-shared-fixture",
      "name": "Shared Fixture"
    },
    {
      "id": "testing-standard-fixture",
      "name": "Standard Fixture"
    },
    {
      "id": "testing-state-verification",
      "name": "State Verification"
    },
    {
      "id": "testing-stored-procedure-test",
      "name": "Stored Procedure Test"
    },
    {
      "id": "testing-suitefixture-setup",
      "name": "SuiteFixture Setup"
    },
    {
      "id": "testing-table-truncation-teardown",
      "name": "Table Truncation Teardown"
    },
    {
      "id": "testing-test-automation-framework",
      "name": "Test Automation Framework"
    },
    {
      "id": "testing-test-discovery",
      "name": "Test Discovery"
    },
    {
      "id": "testing-test-double",
      "name": "Test Double"
    },
    {
      "id": "testing-test-enumeration",
      "name": "Test Enumeration"
    },
    {
      "id": "testing-test-helper",
      "name": "Test Helper"
    },
    {
      "id": "testing-test-hook",
      "name": "Test Hook"
    },
    {
      "id": "testing-test-method",
      "name": "Test Method"
    },
    {
      "id": "testing-test-runner",
      "name": "Test Runner"
    },
    {
      "id": "testing-test-selection",
      "name": "Test Selection"
    },
    {
      "id": "testing-test-spy",
      "name": "Test Spy"
    },
    {
      "id": "testing-test-stub",
      "name": "Test Stub"
    },
    {
      "id": "testing-test-suite-object",
      "name": "Test Suite Object"
    },
    {
      "id": "testing-test-utility-method",
      "name": "Test Utility Method"
    },
    {
      "id": "testing-test-specific-subclass",
      "name": "Test-Specific Subclass"
    },
    {
      "id": "testing-testcase-class",
      "name": "Testcase Class"
    },
    {
      "id": "testing-testcase-class-per-class",
      "name": "Testcase Class per Class"
    },
    {
      "id": "testing-testcase-class-per-feature",
      "name": "Testcase Class per Feature"
    },
    {
      "id": "testing-testcase-class-per-fixture",
      "name": "Testcase Class per Fixture"
    },
    {
      "id": "testing-testcase-object",
      "name": "Testcase Object"
    },
    {
      "id": "testing-testcase-superclass",
      "name": "Testcase Superclass"
    },
    {
      "id": "testing-transaction-rollback-teardown",
      "name": "Transaction Rollback Teardown"
    },
    {
      "id": "testing-unfinished-test-assertion",
      "name": "Unfinished Test Assertion"
    }
  ]
}
