{
  "schema_version": 1,
  "family": {
    "id": "concurrency",
    "name": "Concurrent and networked systems",
    "scope": "Patterns from Pattern-Oriented Software Architecture, Volume 2."
  },
  "defaults": {
    "aliases": [],
    "family": "concurrency",
    "level": "component",
    "maturity": "indexed",
    "sources": [
      {
        "title": "Pattern-Oriented Software Architecture, Volume 2",
        "url": "https://www.dre.vanderbilt.edu/~schmidt/POSA/POSA2/",
        "type": "primary"
      }
    ]
  },
  "patterns": [
    {
      "id": "concurrency-wrapper-facade",
      "name": "Wrapper Facade"
    },
    {
      "id": "concurrency-component-configurator",
      "name": "Component Configurator"
    },
    {
      "id": "concurrency-interceptor",
      "name": "Interceptor"
    },
    {
      "id": "concurrency-extension-interface",
      "name": "Extension Interface"
    },
    {
      "id": "concurrency-reactor",
      "name": "Reactor"
    },
    {
      "id": "concurrency-proactor",
      "name": "Proactor"
    },
    {
      "id": "concurrency-asynchronous-completion-token",
      "name": "Asynchronous Completion Token"
    },
    {
      "id": "concurrency-acceptor-connector",
      "name": "Acceptor-Connector"
    },
    {
      "id": "concurrency-half-sync-half-async",
      "name": "Half-Sync/Half-Async"
    },
    {
      "id": "concurrency-leader-followers",
      "name": "Leader/Followers"
    },
    {
      "id": "concurrency-active-object",
      "name": "Active Object"
    },
    {
      "id": "concurrency-monitor-object",
      "name": "Monitor Object"
    },
    {
      "id": "concurrency-thread-specific-storage",
      "name": "Thread-Specific Storage"
    },
    {
      "id": "concurrency-strategized-locking",
      "name": "Strategized Locking"
    },
    {
      "id": "concurrency-scoped-locking",
      "name": "Scoped Locking"
    },
    {
      "id": "concurrency-thread-safe-interface",
      "name": "Thread-Safe Interface"
    },
    {
      "id": "concurrency-double-checked-locking-optimization",
      "name": "Double-Checked Locking Optimization"
    }
  ]
}
