{
  "schema_version": 1,
  "family": {
    "id": "distributed-systems",
    "name": "Distributed systems",
    "scope": "Patterns of Distributed Systems catalog by Unmesh Joshi."
  },
  "defaults": {
    "aliases": [],
    "family": "distributed-systems",
    "level": "distributed-system",
    "maturity": "indexed",
    "sources": [
      {
        "title": "Patterns of Distributed Systems",
        "url": "https://martinfowler.com/articles/patterns-of-distributed-systems/",
        "type": "primary"
      }
    ]
  },
  "patterns": [
    {
      "id": "distributed-systems-clock-bound-wait",
      "name": "Clock-Bound Wait",
      "source_path": "clock-bound-wait.html"
    },
    {
      "id": "distributed-systems-consistent-core",
      "name": "Consistent Core",
      "source_path": "consistent-core.html"
    },
    {
      "id": "distributed-systems-emergent-leader",
      "name": "Emergent Leader",
      "source_path": "emergent-leader.html"
    },
    {
      "id": "distributed-systems-fixed-partitions",
      "name": "Fixed Partitions",
      "source_path": "fixed-partitions.html"
    },
    {
      "id": "distributed-systems-follower-reads",
      "name": "Follower Reads",
      "source_path": "follower-reads.html"
    },
    {
      "id": "distributed-systems-generation-clock",
      "name": "Generation Clock",
      "source_path": "generation-clock.html"
    },
    {
      "id": "distributed-systems-gossip-dissemination",
      "name": "Gossip Dissemination",
      "source_path": "gossip-dissemination.html"
    },
    {
      "id": "distributed-systems-heartbeat",
      "name": "HeartBeat",
      "source_path": "heartbeat.html"
    },
    {
      "id": "distributed-systems-high-water-mark",
      "name": "High-Water Mark",
      "source_path": "high-watermark.html"
    },
    {
      "id": "distributed-systems-hybrid-clock",
      "name": "Hybrid Clock",
      "source_path": "hybrid-clock.html"
    },
    {
      "id": "distributed-systems-idempotent-receiver",
      "name": "Idempotent Receiver",
      "source_path": "idempotent-receiver.html"
    },
    {
      "id": "distributed-systems-key-range-partitions",
      "name": "Key-Range Partitions",
      "source_path": "key-range-partitions.html"
    },
    {
      "id": "distributed-systems-lamport-clock",
      "name": "Lamport Clock",
      "source_path": "lamport-clock.html"
    },
    {
      "id": "distributed-systems-leader-and-followers",
      "name": "Leader and Followers",
      "source_path": "leader-follower.html"
    },
    {
      "id": "distributed-systems-lease",
      "name": "Lease",
      "source_path": "lease.html"
    },
    {
      "id": "distributed-systems-low-water-mark",
      "name": "Low-Water Mark",
      "source_path": "low-watermark.html"
    },
    {
      "id": "distributed-systems-majority-quorum",
      "name": "Majority Quorum",
      "source_path": "majority-quorum.html"
    },
    {
      "id": "distributed-systems-paxos",
      "name": "Paxos",
      "source_path": "paxos.html"
    },
    {
      "id": "distributed-systems-replicated-log",
      "name": "Replicated Log",
      "source_path": "replicated-log.html"
    },
    {
      "id": "distributed-systems-request-batch",
      "name": "Request Batch",
      "source_path": "request-batch.html"
    },
    {
      "id": "distributed-systems-request-pipeline",
      "name": "Request Pipeline",
      "source_path": "request-pipeline.html"
    },
    {
      "id": "distributed-systems-request-waiting-list",
      "name": "Request Waiting List",
      "source_path": "request-waiting-list.html"
    },
    {
      "id": "distributed-systems-segmented-log",
      "name": "Segmented Log",
      "source_path": "segmented-log.html"
    },
    {
      "id": "distributed-systems-single-socket-channel",
      "name": "Single-Socket Channel",
      "source_path": "single-socket-channel.html"
    },
    {
      "id": "distributed-systems-singular-update-queue",
      "name": "Singular Update Queue",
      "source_path": "singular-update-queue.html"
    },
    {
      "id": "distributed-systems-state-watch",
      "name": "State Watch",
      "source_path": "state-watch.html"
    },
    {
      "id": "distributed-systems-two-phase-commit",
      "name": "Two-Phase Commit",
      "source_path": "two-phase-commit.html"
    },
    {
      "id": "distributed-systems-version-vector",
      "name": "Version Vector",
      "source_path": "version-vector.html"
    },
    {
      "id": "distributed-systems-versioned-value",
      "name": "Versioned Value",
      "source_path": "versioned-value.html"
    },
    {
      "id": "distributed-systems-write-ahead-log",
      "name": "Write-Ahead Log",
      "source_path": "write-ahead-log.html"
    }
  ]
}
